{
  "pack": "screener-batch",
  "country": "TW",
  "yfinance": {
    "info_batch": {
      "_tier": "2",
      "_source": "yfinance",
      "_action": "info-batch",
      "data": {
        "mode": "batch",
        "action": "info",
        "tickers": {
          "2330.TW": {
            "ticker": "2330.TW",
            "fetched_at": "2026-05-01T15:09:00Z",
            "_cache": "hit",
            "_warning": "yfinance is an unofficial scraper. DO NOT use for financial statements (income statement, balance sheet, cash flow). Use SEC EDGAR for financials.",
            "symbol": "2330.TW",
            "shortName": "TAIWAN SEMICONDUCTOR MANUFACTUR",
            "longName": "Taiwan Semiconductor Manufacturing Company Limited",
            "sector": "Technology",
            "industry": "Semiconductors",
            "country": "Taiwan",
            "currency": "TWD",
            "exchange": "TAI",
            "regularMarketPrice": 2135.0,
            "regularMarketPreviousClose": 2180.0,
            "marketCap": 55364816994304,
            "enterpriseValue": 53040035921920,
            "trailingPE": 28.984522,
            "forwardPE": 17.678774,
            "priceToBook": 9.398456,
            "trailingEps": 73.66,
            "forwardEps": 120.76629,
            "dividendYield": 1.12,
            "payoutRatio": 0.2785,
            "fiftyTwoWeekHigh": 2330.0,
            "fiftyTwoWeekLow": 911.0,
            "fiftyDayAverage": 1947.2,
            "twoHundredDayAverage": 1560.175,
            "sharesOutstanding": 25932000000,
            "totalRevenue": 4103903379456,
            "grossMargins": 0.61873,
            "operatingMargins": 0.58105,
            "profitMargins": 0.46505,
            "returnOnEquity": 0.3621,
            "returnOnAssets": 0.17322001,
            "totalDebt": 1016267997184,
            "totalCash": 3383600873472,
            "beta": 1.251,
            "_provenance": {
              "source": "yfinance (unofficial Yahoo Finance scraper)",
              "source_authority": "Yahoo Finance (unofficial, not endorsed)",
              "data_type": "unofficial_scraper",
              "update_cycle": "near-real-time (15 min delay)",
              "typical_lag": "15 minutes (price) / 1 day (fundamentals)",
              "fetched_at": "2026-05-01T15:09:00Z",
              "reference_period": null,
              "staleness_days": null
            }
          },
          "2454.TW": {
            "ticker": "2454.TW",
            "fetched_at": "2026-05-01T15:12:01Z",
            "_cache": "hit",
            "_warning": "yfinance is an unofficial scraper. DO NOT use for financial statements (income statement, balance sheet, cash flow). Use SEC EDGAR for financials.",
            "symbol": "2454.TW",
            "shortName": "MEDIATEK INC",
            "longName": "MediaTek Inc.",
            "sector": "Technology",
            "industry": "Semiconductors",
            "country": "Taiwan",
            "currency": "TWD",
            "exchange": "TAI",
            "regularMarketPrice": 2610.0,
            "regularMarketPreviousClose": 2575.0,
            "marketCap": 4165847744512,
            "enterpriseValue": 3985525964800,
            "trailingPE": 39.52749,
            "forwardPE": 24.273758,
            "priceToBook": 10.399028,
            "trailingEps": 66.03,
            "forwardEps": 107.52352,
            "dividendYield": 2.05,
            "payoutRatio": 0.8178,
            "fiftyTwoWeekHigh": 2685.0,
            "fiftyTwoWeekLow": 1130.0,
            "fiftyDayAverage": 1828.0,
            "twoHundredDayAverage": 1525.55,
            "sharesOutstanding": 1596110205,
            "totalRevenue": 591804694528,
            "grossMargins": 0.4703,
            "operatingMargins": 0.15348,
            "profitMargins": 0.16923,
            "returnOnEquity": 0.25424,
            "returnOnAssets": 0.08262,
            "totalDebt": 16440000512,
            "totalCash": 194779004928,
            "_provenance": {
              "source": "yfinance (unofficial Yahoo Finance scraper)",
              "source_authority": "Yahoo Finance (unofficial, not endorsed)",
              "data_type": "unofficial_scraper",
              "update_cycle": "near-real-time (15 min delay)",
              "typical_lag": "15 minutes (price) / 1 day (fundamentals)",
              "fetched_at": "2026-05-01T15:12:01Z",
              "reference_period": null,
              "staleness_days": null
            }
          }
        },
        "_partial": false,
        "_summary": {
          "2330.TW": "ok",
          "2454.TW": "ok"
        }
      }
    },
    "history_batch": {
      "_tier": "2",
      "_source": "yfinance",
      "_action": "history-batch",
      "data": {
        "mode": "batch",
        "action": "history",
        "tickers": {
          "2330.TW": {
            "ticker": "2330.TW",
            "period": "1y",
            "interval": "1d",
            "fetched_at": "2026-05-01T15:09:01Z",
            "_cache": "hit",
            "data": [
              {
                "date": "2026-04-24",
                "open": 2110.0,
                "high": 2190.0,
                "low": 2105.0,
                "close": 2185.0,
                "volume": 45088050
              },
              {
                "date": "2026-04-27",
                "open": 2280.0,
                "high": 2330.0,
                "low": 2265.0,
                "close": 2265.0,
                "volume": 68696037
              },
              {
                "date": "2026-04-28",
                "open": 2245.0,
                "high": 2280.0,
                "low": 2215.0,
                "close": 2215.0,
                "volume": 47175356
              },
              {
                "date": "2026-04-29",
                "open": 2175.0,
                "high": 2210.0,
                "low": 2165.0,
                "close": 2180.0,
                "volume": 42895935
              },
              {
                "date": "2026-04-30",
                "open": 2205.0,
                "high": 2215.0,
                "low": 2135.0,
                "close": 2135.0,
                "volume": 48975164
              }
            ],
            "latest_close": 2135.0,
            "latest_date": "2026-04-30",
            "rows": 5,
            "_provenance": {
              "source": "yfinance (unofficial Yahoo Finance scraper)",
              "source_authority": "Yahoo Finance (unofficial, not endorsed)",
              "data_type": "unofficial_scraper",
              "update_cycle": "near-real-time (15 min delay)",
              "typical_lag": "15 minutes (price) / 1 day (fundamentals)",
              "fetched_at": "2026-05-01T15:09:01Z",
              "reference_period": "2026-04-30",
              "staleness_days": 1
            }
          },
          "2454.TW": {
            "ticker": "2454.TW",
            "period": "1y",
            "interval": "1d",
            "fetched_at": "2026-05-01T15:12:12Z",
            "_cache": "miss",
            "data": [
              {
                "date": "2026-04-24",
                "open": 2340.0,
                "high": 2435.0,
                "low": 2330.0,
                "close": 2435.0,
                "volume": 21684950
              },
              {
                "date": "2026-04-27",
                "open": 2470.0,
                "high": 2575.0,
                "low": 2410.0,
                "close": 2435.0,
                "volume": 23842383
              },
              {
                "date": "2026-04-28",
                "open": 2490.0,
                "high": 2675.0,
                "low": 2485.0,
                "close": 2615.0,
                "volume": 22923298
              },
              {
                "date": "2026-04-29",
                "open": 2550.0,
                "high": 2595.0,
                "low": 2500.0,
                "close": 2575.0,
                "volume": 11761568
              },
              {
                "date": "2026-04-30",
                "open": 2665.0,
                "high": 2685.0,
                "low": 2565.0,
                "close": 2610.0,
                "volume": 16785387
              }
            ],
            "latest_close": 2610.0,
            "latest_date": "2026-04-30",
            "rows": 5,
            "_provenance": {
              "source": "yfinance (unofficial Yahoo Finance scraper)",
              "source_authority": "Yahoo Finance (unofficial, not endorsed)",
              "data_type": "unofficial_scraper",
              "update_cycle": "near-real-time (15 min delay)",
              "typical_lag": "15 minutes (price) / 1 day (fundamentals)",
              "fetched_at": "2026-05-01T15:12:12Z",
              "reference_period": "2026-04-30",
              "staleness_days": 1
            }
          }
        },
        "_partial": false,
        "_summary": {
          "2330.TW": "ok",
          "2454.TW": "ok"
        }
      }
    }
  },
  "mops": {
    "2330.TW": {
      "_tier": "A",
      "_source": "mops",
      "_action": "company-basic",
      "data": {
        "action": "company-basic",
        "fetched_at": "2026-05-01T15:12:12Z",
        "_cache": "hit",
        "_provenance": {
          "source": "MOPS JSON API (mops.twse.com.tw/mops/api)",
          "source_authority": "金管會證期局 / 台灣證券交易所",
          "data_type": "official_regulatory_disclosure",
          "update_cycle": "filing-driven",
          "typical_lag": "varies by form; quarterly FS ~45 days after period-end",
          "fetched_at": "2026-05-01T15:12:12Z",
          "reference_period": null,
          "staleness_days": null
        },
        "data": {
          "listingDate": {
            "isHidden": false,
            "value": "83/09/05"
          },
          "annualFinancialReport": {
            "isHidden": true,
            "value": ""
          },
          "reviewAccountingOffice": {
            "isHidden": true,
            "value": ""